mysql> create database VP21MC043_Election
    -> ;
Query OK, 1 row affected (0.01 sec)

mysql> use VP21MC043_Election;
Database changed
mysql> show tables;
Empty set (0.00 sec)

mysql> create table CONSTITUENCY(CONS_id number(20),
    -> primary key,CSNAME varchar(20),CSSTATE varchar(20),NUMBER_OF_VOTERS number(10));
ERROR 1064 (42000): You have an error in your SQL syntax; check the manual that corresponds to your MySQL server version for the right syntax to use near 'number(20),
primary key,CSNAME varchar(20),CSSTATE varchar(20),NUMBER_OF_VOTERS ' at line 1
mysql> create table CONSTITUENCY(CONS_id number(20)primary key,CSNAME varchar(20),CSSTATE varchar(20),NUMBER_OF_VOTERS number(10));
ERROR 1064 (42000): You have an error in your SQL syntax; check the manual that corresponds to your MySQL server version for the right syntax to use near 'number(20)primary key,CSNAME varchar(20),CSSTATE varchar(20),NUMBER_OF_VOTERS nu' at line 1
mysql> create table CONSTITUENCY(CONS_id number(20)primary key,CSNAME varchar(20),CSSTATE varchar(20),NUMBER_OF_VOTERS number(10));
ERROR 1064 (42000): You have an error in your SQL syntax; check the manual that corresponds to your MySQL server version for the right syntax to use near 'number(20)primary key,CSNAME varchar(20),CSSTATE varchar(20),NUMBER_OF_VOTERS nu' at line 1
mysql> 
mysql> 
mysql> create table CONSTITUENCY(CONS_id number(20)primary key,CSNAME varchar(20),CSSTATE varchar(20),NUMBER_OF_VOTERS number(10));
ERROR 1064 (42000): You have an error in your SQL syntax; check the manual that corresponds to your MySQL server version for the right syntax to use near 'number(20)primary key,CSNAME varchar(20),CSSTATE varchar(20),NUMBER_OF_VOTERS nu' at line 1
mysql> create table CONSTITUENCY(CONS_id number(20)primary key,CSNAME varchar(20),CSSTATE varchar(20),NUMBER_OF_VOTERS number(10));
ERROR 1064 (42000): You have an error in your SQL syntax; check the manual that corresponds to your MySQL server version for the right syntax to use near 'number(20)primary key,CSNAME varchar(20),CSSTATE varchar(20),NUMBER_OF_VOTERS nu' at line 1
mysql> 
mysql> 
mysql> 
mysql> 
mysql> create table CONSTITUENCY(CONS_id varchar(20)primary key,CSNAME varchar(20),CSSTATE varchar(20),NUMBER_OF_VOTERS int(10));
Query OK, 0 rows affected, 1 warning (0.02 sec)

mysql> DESC CONSTITUENCY;
+------------------+-------------+------+-----+---------+-------+
| Field            | Type        | Null | Key | Default | Extra |
+------------------+-------------+------+-----+---------+-------+
| CONS_id          | varchar(20) | NO   | PRI | NULL    |       |
| CSNAME           | varchar(20) | YES  |     | NULL    |       |
| CSSTATE          | varchar(20) | YES  |     | NULL    |       |
| NUMBER_OF_VOTERS | int         | YES  |     | NULL    |       |
+------------------+-------------+------+-----+---------+-------+
4 rows in set (0.00 sec)

mysql> create table PARTY(PID int(20)primary key,
    -> PNAME varchar(20),
    -> PSYMBOL varchar(10));
Query OK, 0 rows affected, 1 warning (0.02 sec)

mysql> DESC PARTY;
+---------+-------------+------+-----+---------+-------+
| Field   | Type        | Null | Key | Default | Extra |
+---------+-------------+------+-----+---------+-------+
| PID     | int         | NO   | PRI | NULL    |       |
| PNAME   | varchar(20) | YES  |     | NULL    |       |
| PSYMBOL | varchar(10) | YES  |     | NULL    |       |
+---------+-------------+------+-----+---------+-------+
3 rows in set (0.00 sec)

mysql> create table CANDIDATES(CAND_ID int(12)primary key,
    -> PHONE NUMBER(10),
    -> AGE int(10),
    -> STATE varchar(20),
    -> name varchar(20),
    -> PID int reference PARTY(PID));
ERROR 1064 (42000): You have an error in your SQL syntax; check the manual that corresponds to your MySQL server version for the right syntax to use near 'NUMBER(10),
AGE int(10),
STATE varchar(20),
name varchar(20),
PID int reference ' at line 2
mysql> create table CANDIDATES(CAND_ID int(12)primary key, PHONE int(10), AGE int(10), STATE varchar(20), name varchar(20), PID int reference
PARTY(PID));
ERROR 1064 (42000): You have an error in your SQL syntax; check the manual that corresponds to your MySQL server version for the right syntax to use near 'reference PARTY(PID))' at line 1
mysql> 
mysql> create table CANDIDATES(CAND_ID int(12)primary key,NAME varchar(20), PHONE int(10), AGE int(10), STATE varchar(20), PID int reference PARTY(PID));
ERROR 1064 (42000): You have an error in your SQL syntax; check the manual that corresponds to your MySQL server version for the right syntax to use near 'reference PARTY(PID))' at line 1
mysql> 
mysql> create table CANDIDATES(CAND_ID int(12)primary key,NAME varchar(20), PHONE int(10), AGE int(10), STATE varchar(20), PID int references
PARTY(PID));
Query OK, 0 rows affected, 3 warnings (0.02 sec)

mysql> DESC CANDIDATES;
+---------+-------------+------+-----+---------+-------+
| Field   | Type        | Null | Key | Default | Extra |
+---------+-------------+------+-----+---------+-------+
| CAND_ID | int         | NO   | PRI | NULL    |       |
| NAME    | varchar(20) | YES  |     | NULL    |       |
| PHONE   | int         | YES  |     | NULL    |       |
| AGE     | int         | YES  |     | NULL    |       |
| STATE   | varchar(20) | YES  |     | NULL    |       |
| PID     | int         | YES  |     | NULL    |       |
+---------+-------------+------+-----+---------+-------+
6 rows in set (0.00 sec)

mysql> create table CONTEST(CAND_ID int(10),CANS_ID int(10),Foreign key(CAND_ID)references  CANDIDATES(CAND_ID),Foreign key(CONS_id)CONS_ID int references CONSTITUENCY(CONS_id);
Query OK, 0 rows affected (0.03 sec)

mysql> DESC CONTEST;
+---------+------+------+-----+---------+-------+
| Field   | Type | Null | Key | Default | Extra |
+---------+------+------+-----+---------+-------+
| CAND_ID | int  | YES  |     | NULL    |       |
| CONS_ID | int  | YES  |     | NULL    |       |
+---------+------+------+-----+---------+-------+
2 rows in set (0.00 sec)

mysql> 

mysql> DESC VOTERS;
+---------+-------------+------+-----+---------+-------+
| Field   | Type        | Null | Key | Default | Extra |
+---------+-------------+------+-----+---------+-------+
| VID     | varchar(20) | YES  |     | NULL    |       |
| NAME    | varchar(20) | YES  |     | NULL    |       |
| AGE     | int         | YES  |     | NULL    |       |
| CITY    | varchar(20) | YES  |     | NULL    |       |
| PINCODE | int         | YES  |     | NULL    |       |
| STATE   | varchar(20) | YES  |     | NULL    |       |
| CAND_ID | int         | YES  | MUL | NULL    |       |
| CONS_id | varchar(20) | YES  | MUL | NULL    |       |
+---------+-------------+------+-----+---------+-------+
8 rows in set (0.01 sec)


mysql> DESC CANDIDATES;
+---------+-------------+------+-----+---------+-------+
| Field   | Type        | Null | Key | Default | Extra |
+---------+-------------+------+-----+---------+-------+
| CAND_ID | int         | NO   | PRI | NULL    |       |
| NAME    | varchar(20) | YES  |     | NULL    |       |
| PHONE   | int         | YES  |     | NULL    |       |
| AGE     | int         | YES  |     | NULL    |       |
| STATE   | varchar(20) | YES  |     | NULL    |       |
| PID     | int         | YES  | MUL | NULL    |       |
+---------+-------------+------+-----+---------+-------+
6 rows in set (0.00 sec)

mysql> select * from CANDIDATES;
+---------+------------+-----------+------+-----------+------+
| CAND_ID | NAME       | PHONE     | AGE  | STATE     | PID  |
+---------+------------+-----------+------+-----------+------+
|    1001 | AshaLATHA  |     89789 |   39 | KARNATAKA |  111 |
|    1002 | RamKrishna | 789345678 |   45 | KARNATAKA |  222 |
|    1003 | Jayalatha  | 872309126 |   45 | KARNATAKA |  333 |
|    1004 | laxhmi     | 873429840 |   45 | KARNATAKA |  444 |
|    1005 | Amrutha    | 672349012 |   26 | KARNATAKA |  111 |
+---------+------------+-----------+------+-----------+------+


mysql> select * from PARTY;
+-----+-------+---------+
| PID | PNAME | PSYMBOL |
+-----+-------+---------+
| 111 | KKK   | FLOWER  |
| 222 | HRS   | CYCLE   |
| 333 | ULL   | AUTO    |
| 444 | SRE   | WATER   |
+-----+-------+---------+
4 rows in set (0.01 sec)

mysql> select * from CONSTITUENCY;
+---------+----------+-----------+------------------+
| CONS_id | CSNAME   | CSSTATE   | NUMBER_OF_VOTERS |
+---------+----------+-----------+------------------+
| 100     | BANGLORE | KARNATAKA |              200 |
| 101     | MANGLORE | KARNATAKA |              400 |
| 102     | MANDYA   | KARNATAKA |             1000 |
| 103     | BELGAVI  | KARNATAKA |             2000 |
| 104     | YADAGIRI | KARNATAKA |             3000 |
+---------+----------+-----------+------------------+

mysql> select * from VOTERS;
+-----+--------+------+----------+---------+-----------+---------+---------+
| VID | NAME   | AGE  | CITY     | PINCODE | STATE     | CAND_ID | CONS_id |
+-----+--------+------+----------+---------+-----------+---------+---------+
| V01 | Hitha  |   21 | PUTTUR   |  567343 | KARNATAKA |    1001 | 100     |
| V02 | KARANA |   28 | SULLIA   |  683456 | KARNATAKA |    1003 | 102     |
| V03 | asha   |   24 | KADABA   |  783456 | KARNATAKA |    1002 | 101     |
| V04 | akash  |   24 | MANGLORE |  123456 | KARNATAKA |    1004 | 104     |
+-----+--------+------+----------+---------+-----------+---------+---------+
4 rows in set (0.00 sec)

mysql> select * from CONTEST;
+---------+---------+
| CAND_ID | CONS_id |
+---------+---------+
|    1001 | 100     |
|    1002 | 101     |
|    1003 | 102     |
|    1004 | 103     |
|    1005 | 104     |
|    1001 | 101     |
|    1002 | 104     |
+---------+---------+
7 rows in set (0.00 sec



(i)
select * from CANDIDATES  
where CAND_ID in (select CAND_ID from CONTEST,CANDIDATES,CONSTITUENCY 
where CONTEST.CONS_id=CONSTITUENCY.CONS_id 
group by CAND_ID
 having COUNT(distinct(CSSTATE))>1);



mysql> select * from CANDIDATES where CAND_ID IN(select CAND_ID from CONTEST,CONSTITUENCY  where CONTEST.CONS_id=CONSTITUENCY.CONS_id  group by CAND_ID  having COUNT(distinct(CSSTATE))>1);
+---------+------------+-----------+------+-----------+------+
| CAND_ID | NAME       | PHONE     | AGE  | STATE     | PID  |
+---------+------------+-----------+------+-----------+------+
|    1001 | AshaLATHA  |     89789 |   39 | KARNATAKA |  111 |
|    1002 | RamKrishna | 789345678 |   45 | KARNATAKA |  222 |
+---------+------------+-----------+------+-----------+------+
2 rows in set (0.01 sec)



(ii)
mysql> select MAX(CSSTATE) from CONSTITUENCY;
+--------------+
| MAX(CSSTATE) |
+--------------+
| TAMILNADU    |
+--------------+
1 row in set (0.00 sec)

(iii)
abc.sql
DELIMITER //
create procedure abc(IN VID int(10),IN NAME varchar(20),IN AGE int(10),IN CITY varchar(20),IN PINCODE varchar(10),IN STATE varchar(20))
begin
declare msg varchar(20);
if AGE>=18 then
insert into VOTERS(VID,NAME,AGE,CITY)values(VID,VNAME,AGE,CITY);
set msg="row inserted";
else
set msg="voter not eligible";
end if;
select msg;
end //
DELIMITER ;




mysql> source abc.sql;
Query OK, 0 rows affected, 2 warnings (0.00 sec)

mysql> call abc(1,'Shraddha',17,'puttur');
ERROR 1318 (42000): Incorrect number of arguments for PROCEDURE VP21MC043_Election.abc; expected 6, got 4
mysql> call abc(1,'Shraddha',17,'puttur',34567,'KARNATAKA');
+--------------------+
| msg                |
+--------------------+
| voter not eligible |
+--------------------+
1 row in set (0.00 sec)

Query OK, 0 rows affected (0.00 sec)





(iii)
abc.sql
DELIMITER //
create procedure abc(IN VID int(10),IN NAME varchar(20),IN AGE int(10),IN CITY varchar(20),IN PINCODE varchar(10),IN STATE varchar(20))
begin
declare msg varchar(20);
if AGE>=18 then
insert into VOTERS(VID,NAME,AGE,CITY)values(VID,VNAME,AGE,CITY);
set msg="row inserted";
else
set msg="voter not eligible";
end if;
select msg;
end //
DELIMITER ;




(iv)
contest.sql
DELIMITER //
CREATE PROCEDURE new(csname varcahr(20))
begin
select NUMBER_OF_VOTERS  from CONSTITUENCY where CSNAME=CSNAME;
end //
DELIMITER;
mysql> CREATE PROCEDURE new(csname varchar(20)) begin select NUMBER_OF_VOTERS  from CONSTITUENCY where CSNAME=csname; end//
Query OK, 0 rows affected (0.00 sec)

mysql> call new('kadaba');
    -> //
+------------------+
| NUMBER_OF_VOTERS |
+------------------+
|              200 |
|              400 |
|             1000 |
|             2000 |
|             3000 |
+------------------+
5 rows in set (0.00 sec)
Query OK, 0 rows affected (0.00 sec)
+------------------+
| NUMBER_OF_VOTERS |
+------------------+
|              200 |
|              400 |
|             1000 |
|             2000 |
|             3000 |
+------------------+
5 rows in set (0.00 sec)
Query OK, 0 rows affected (0.00 sec)

voter.sql



(v)
DELIMITER $$
create trigger new
after insert on VOTERS  for each row 
begin
update CONSTITUENCY set CONSTITUENCY.NUMBER_OF_VOTERS=CONSTITUENCY.NUMBER_OF_VOTERS+3
where CONS_id=new.CONS_id;
end$$

select * from VOTERS;
+-----+--------+------+----------+---------+-----------+---------+---------+
| VID | NAME   | AGE  | CITY     | PINCODE | STATE     | CAND_ID | CONS_id |
+-----+--------+------+----------+---------+-----------+---------+---------+
| V01 | Hitha  |   21 | PUTTUR   |  567343 | KARNATAKA |    1001 | 100     |
| V02 | KARANA |   28 | SULLIA   |  683456 | KARNATAKA |    1003 | 102     |
| V03 | asha   |   24 | KADABA   |  783456 | KARNATAKA |    1002 | 101     |
| V04 | akash  |   24 | MANGLORE |  123456 | KARNATAKA |    1004 | 104     |
+-----+--------+------+----------+---------+-----------+---------+---------+
4 rows in set (0.00 sec)

insert into VOTERS values('V05','Abhijna',18,'Mani',678345,'Maharastra',1001,'102');
Query OK, 1 row affected (0.00 sec)

mysql> insert into VOTERS values('V06','Anu',23,'arak',756889,'Kerala',1001,'101');
    -> $$
Query OK, 1 row affected (0.00 sec)

mysql> select * from CONSTITUENCY;
    -> $$
+---------+----------+------------+------------------+
| CONS_id | CSNAME   | CSSTATE    | NUMBER_OF_VOTERS |
+---------+----------+------------+------------------+
| 100     | BANGLORE | KARNATAKA  |              200 |
| 101     | MANGLORE | Andra      |              403 |
| 102     | MANDYA   | MAHARASTRA |             1003 |
| 103     | BELGAVI  | TAMILNADU  |             2000 |
| 104     | YADAGIRI | KERALA     |             3000 |
+---------+----------+------------+------------------+
5 rows in set (0.00 sec)


